{
  "schema": "sg.bundle/1",
  "target_day": "2026-10-13",
  "slug": "saham-gorengan-market-cap-berapa",
  "pillar": "berita",
  "title": "Saham Gorengan Market Cap Berapa? Ukur 4 Angka Ini",
  "research": {
    "cluster": "berita",
    "seed_keywords": ["saham gorengan", "saham indonesia", "cara main saham"],
    "primary_keyword": {"keyword": "saham gorengan", "volume": 1900, "sd": 14, "pd": 1, "competition": 0.01,
                        "intent": "Informational", "source": "ubersuggest", "fetched": "2026-10-12"},
    "secondary_keywords": [
      {"keyword": "saham gorengan adalah", "volume": 2400, "sd": 17, "competition": 0},
      {"keyword": "apa itu saham gorengan", "volume": 720, "sd": 13, "competition": 0.01},
      {"keyword": "saham gorengan market cap berapa", "volume": null, "source": "google_suggestions"},
      {"keyword": "ciri ciri saham gorengan", "volume": null, "source": "match_keywords"}
    ],
    "question": {
      "text": "Saham gorengan market cap berapa?",
      "variants": ["saham gorengan market cap berapa", "saham gorengan adalah dan contohnya", "saham gorengan fundamental bagus", "ciri ciri saham gorengan"],
      "type": "unanswered",
      "evidence": "SERP 'saham gorengan adalah' (Ubersuggest, ID, update 2026-10-06) diisi definisi umum: Liputan6/Kontan (penjelasan CIO Danantara), Bizhare, Orami, Nanovest, Kompas, HSB. Tidak ada yang memberi angka terukur (market cap, nilai transaksi harian, kedalaman antrean, free float) atau simulasi; belum ada yang membahas dampak batas harga Rp1 dan penghapusan kriteria likuiditas PPK per 28 Sep 2026. Situs sudah punya pilar /saham-gorengan/, jadi artikel ini menjawab sub-pertanyaan terukur dan menautkan ke pilar.",
      "gap_score": 0.8
    },
    "serp_top": [
      {"url": "https://www.liputan6.com/saham/read/6270198/apa-itu-saham-gorengan-ini-penjelasan-cio-danantara", "note": "definisi, tanpa angka"},
      {"url": "https://www.bizhare.id/media/investasi/saham-gorengan", "note": "ciri umum, listicle"},
      {"url": "https://money.kompas.com/read/2026/02/15/153709826/kenali-ciri-saham-gorengan-begini-strategi-aman-investor-ritel", "note": "strategi umum, tanpa simulasi"}
    ],
    "ubersuggest_reports_used": 3
  },
  "assets": {
    "hero": {"kind": "image", "render": {"template": "web_hero", "data": {
      "headline": "Saham gorengan *market cap* berapa? Ukur 4 angka ini",
      "mascot": {"pose": "think", "expression": "think", "accessory": "glasses"}}}},
    "og": {"kind": "image", "render": {"template": "og", "data": {
      "eyebrow": "Insight Saham Gorengan", "headline": "Saham gorengan *market cap* berapa?",
      "mascot": {"pose": "present", "expression": "smirk"}}}},
    "slides": {"kind": "carousel", "render": {"slides": [
      {"template": "cover", "alt": "Bull berpikir dengan judul: Saham gorengan market cap berapa?",
       "data": {"eyebrow": "Edukasi Saham", "headline": "Saham gorengan *market cap* berapa?",
                "subhead": "Jawabannya: tidak ada angka resmi. Ini 4 angka yang lebih jujur.",
                "mascot": {"pose": "think", "expression": "think"}}},
      {"template": "point", "alt": "Timbangan dan koin: market cap kecil belum tentu digoreng",
       "data": {"number": 1, "eyebrow": "Mulai dari sini", "heading": "Market cap bukan *vonis*",
                "body": "Market cap = harga x jumlah saham. Kecil belum tentu digoreng, besar belum tentu aman. BEI juga tidak punya kategori resmi bernama saham gorengan.",
                "art": {"viewbox": "0 0 936 420", "props": [{"name": "scale", "x": 250, "y": 220, "size": 300}, {"name": "coin", "x": 470, "y": 300, "size": 150}],
                        "mascot": {"pose": "present", "expression": "smirk", "x": 690, "y": 420, "height": 400}}}},
      {"template": "stat", "alt": "Angka Rp1: batas harga saham terendah sejak 28 September 2026",
       "data": {"eyebrow": "Aturan baru", "value": "Rp1", "label": "batas harga terendah sejak 28 Sep 2026",
                "context": "Sebelumnya Rp50. Harga nominal makin tidak bisa jadi patokan murah atau berisiko.",
                "source": "KabarBursa 27/9/2026, Perubahan Peraturan BEI I-X & II-X",
                "mascot": {"pose": "warn", "expression": "serious", "accessory": "tie"}}},
      {"template": "point", "alt": "Kaca pembesar di atas candlestick: bandingkan modal penggerak dengan nilai transaksi",
       "data": {"number": 2, "eyebrow": "Angka paling penting", "heading": "Nilai transaksi *harian*",
                "body": "Bandingkan modal yang dibutuhkan untuk menggeser harga dengan nilai transaksi rata-rata harian. Makin besar porsinya, makin mudah harga didorong naik atau dijatuhkan.",
                "art": {"viewbox": "0 0 936 420", "props": [{"name": "candles", "x": 230, "y": 210, "size": 320}, {"name": "magnifier", "x": 420, "y": 250, "size": 200}],
                        "mascot": {"pose": "explain", "expression": "smirk", "x": 690, "y": 420, "height": 400}}}},
      {"template": "example", "alt": "Simulasi hipotetis modal Rp93 juta menyapu 5 level antrean jual",
       "data": {"heading": "Berapa modal untuk naik *8%*?",
                "scenario": "Asumsi: harga Rp60, fraksi Rp1, antrean jual 3.000 lot di tiap level Rp60-Rp64, nilai transaksi harian Rp400 juta.",
                "steps": ["3.000 lot x 100 = 300.000 lembar per level", "300.000 x (60+61+62+63+64) = Rp93 juta", "Harga naik ke Rp65 (+8,3%) = 23% nilai transaksi harian"],
                "result": "Rasio dorong *23%*: harga mudah digerakkan, juga mudah jatuh."}},
      {"template": "point", "alt": "Wajan kecil di atas api: free float kecil seperti wajan dengan sedikit minyak",
       "data": {"number": 3, "eyebrow": "Kolam yang beredar", "heading": "Free float itu *wajannya*",
                "body": "Saham publik sedikit ibarat wajan kecil: cepat panas, cepat gosong. Minimum free float kini 15% (berlaku 31 Mar 2026, transisi sampai 2029).",
                "art": {"viewbox": "0 0 936 420", "props": [{"name": "wok", "x": 260, "y": 210, "size": 320}, {"name": "fire", "x": 260, "y": 360, "size": 120}],
                        "mascot": {"pose": "warn", "expression": "worried", "x": 690, "y": 420, "height": 400}}}},
      {"template": "myth_fact", "alt": "Mitos harga di bawah Rp100 pasti gorengan, fakta ukur likuiditas",
       "data": {"myth": "Saham di bawah Rp100 pasti saham gorengan.",
                "fact": "Harga nominal tidak mengukur risiko. Ukur likuiditas, kedalaman antrean, free float, lalu cek notasi, status UMA, dan suspensi di keterbukaan informasi BEI."}},
      {"template": "checklist", "alt": "Checklist 4 angka sebelum ikut euforia saham",
       "data": {"eyebrow": "Checklist", "heading": "4 angka sebelum ikut *euforia*",
                "items": ["Nilai transaksi rata-rata 20 hari, bukan persen naik hari ini",
                          "Modal untuk menyapu 5 level antrean dibanding nilai transaksi harian",
                          "Free float dan sebaran pemegang saham",
                          "Status UMA, suspensi, atau papan pemantauan khusus"]}},
      {"template": "cta", "alt": "Bull melambai: simpan, bagikan, baca versi lengkap di sahamgorengan.id", "data": {}}
    ]}},
    "short": {"kind": "video", "render": {"storyboard": {
      "title": "Saham gorengan *market cap* berapa?", "eyebrow": "Shorts",
      "scenes": [
        {"vo": "Saham gorengan itu market cap-nya berapa, sih?", "caption": "Saham gorengan itu *market cap*-nya berapa?",
         "headline": "Market cap *berapa*?", "mascot": {"pose": "think", "expression": "think", "side": "right"},
         "props": [{"name": "coin", "x": 300, "y": 900, "size": 280, "loop": "spin"}], "min_duration": 2.6},
        {"vo": "Faktanya, bursa tidak punya angka resmi untuk menyebut saham gorengan.", "caption": "Bursa *tidak punya* angka resmi",
         "headline": "Tidak ada angka *resmi*", "mascot": {"pose": "shrug", "expression": "worried", "side": "left"},
         "props": [{"name": "document", "x": 790, "y": 880, "size": 300, "loop": "float"}]},
        {"vo": "Yang bikin harga gampang didorong adalah antrean jual yang tipis.", "caption": "Kuncinya: antrean jual yang *tipis*",
         "headline": "Antrean jual *tipis*", "mascot": {"pose": "explain", "expression": "smirk", "side": "left"},
         "props": [{"name": "candles", "x": 790, "y": 880, "size": 340, "loop": "float"}]},
        {"vo": "Simulasi hipotetis: sembilan puluh tiga juta rupiah cukup menyapu lima level antrean.", "caption": "Simulasi: *Rp93 juta* sapu 5 level antrean",
         "headline": "Simulasi *hipotetis*", "mascot": {"pose": "present", "expression": "smirk", "side": "right"},
         "counter": {"from": 0, "to": 93, "prefix": "Rp", "suffix": " jt", "x": 290, "y": 880, "size": 150}},
        {"vo": "Harga naik delapan persen, padahal itu hampir seperempat nilai transaksi hariannya.", "caption": "Naik *8%* = hampir ¼ nilai transaksi harian",
         "headline": "Naik *8%*", "mascot": {"pose": "think", "expression": "shock", "side": "right"},
         "props": [{"name": "arrow_up", "x": 320, "y": 880, "size": 300, "loop": "pulse"}]},
        {"vo": "Dan sejak dua puluh delapan September, harga saham bisa turun sampai satu rupiah.", "caption": "Sejak 28 Sep 2026 batas bawah harga *Rp1*",
         "headline": "Batas bawah *Rp1*", "bg": "red", "mascot": {"pose": "warn", "expression": "serious", "side": "left", "accessory": "tie"},
         "props": [{"name": "arrow_down", "x": 790, "y": 880, "size": 300, "loop": "pulse"}]},
        {"vo": "Jadi cek nilai transaksi, free float, dan status UMA sebelum ikut euforia.", "caption": "Cek *nilai transaksi*, *free float*, status UMA",
         "headline": "Cek 3 hal ini", "mascot": {"pose": "explain", "expression": "smirk", "side": "right", "accessory": "glasses"},
         "props": [{"name": "magnifier", "x": 300, "y": 820, "size": 260, "loop": "wobble"}, {"name": "shield", "x": 330, "y": 1110, "size": 200, "delay": 0.6}]},